{
  "schema_version": "virtualization-ai.redhat-intel.com/modernization-request/v1",
  "correlation_id": "30100000-0000-4000-8000-000000000001",
  "task": "review-vm-modernization",
  "note": "Review the governed service path and placement evidence for this synthetic VM workload.",
  "allowed_categories": ["identity", "connectivity", "placement", "operations", "unknown"],
  "declared": {
    "identity": {"namespace": "virtualization-ai-401", "vm_name": "modernization-client", "service_account": "vm-modernization-client"},
    "destination": {"service": "virtualization-ai-401-adapter", "port": 8080},
    "placement": {"architecture": "amd64", "required_labels": {"feature.node.kubernetes.io/cpu-model.vendor_id": "Intel"}}
  },
  "observed": {
    "identity": {"namespace": "virtualization-ai-401", "vm_name": "modernization-client", "service_account": "vm-modernization-client", "vmi_uid": "rehearsal-vmi-uid"},
    "destination": {"service": "virtualization-ai-401-adapter", "port": 8080, "network_policy": "ENFORCED", "endpoints_ready": true},
    "placement": {"node_name": "rehearsal-node", "architecture": "amd64", "required_labels": {}, "labels": {"feature.node.kubernetes.io/cpu-model.vendor_id": "Intel"}},
    "observability": {"correlation_id": "30100000-0000-4000-8000-000000000001", "collected_at": "2026-09-28T12:00:00Z", "events_available": true}
  }
}
